comment,label
valu money ganda idto yong thin lang ta nakakaputi rin yong color perfect smart watch fav rin color must buy ulit ibang color naman,2
arriv good condit pag date nagamit agad bubbl wrap sya sure safe safe yung item pag prob bili ulit,2
appear excel valu money afford item ship time although bit disappoint order ivori case item ship strap okay item good well packag order soon,2
st tjme tri brand hope would saisfi fast tran god bless,2
valu money,2
good big display batteri good xiaomi second order shop parcel arriv safe secur look premium afford shope order hope last,2
valu money best valu new favorit good qualiti correct variat pinadala damag bagay bagay casual getup,2
good solid talaga juic mo,2
good good valu money good okay naman wala naman saktu okay yung size good qualiti talagan mabili lang dumat tapo damag,2
yet tri look ok let check first edit review tri fast ship way safe packag plea see video photo refer,2
durabl valu money good price maganda seal safe product tama order safe okay okay ganda item,2
diamond valu money item secur nice pack item receiv good condit nice look shini compar case like much,2
qualiti product realli good realli worth buy soon good product,2
valu money qt like much forev ever amen frckin cute omi ghad satisfi buyer,2
great color devic great bili dumat maganda qualiti recommend itong shop ganda talaga color mura ibang shop probabl buy next time solid,2
materi qualiti colour appear worth money,2
packag arriv three day satisfi product receiv great deal price fit perfect appl watch se,2
coffe pod work cola tast supplier longer respons say order complet would know pod work test item upon deliveri,0
packag came quick brand new unopen make feel good color correct beauti watch second time order look forward strong recommend,2
realli good price valu money good cheapest appl pencil nib ive seen realli good le smooth compar origin rough patch price realli good,2
yung camera po ganda po magaan lang po sya po nagla log first time order phone onlin time pangangamba wow bili naman dumat tsaka yun gaan lang nya tapo rin nagla log ma nauna expect date deliveri deliveri man,2
well pack complet order damag super love color nice materi parang origin definit order order last deliv,2
item good shape nice product item tank top men well good shopp legendari,2
work advertis valu money worth price good item arriv good condit damag work advertis high recommend product good product freebi,2
good good valu money good po complet item maganda qualiti mura,2
first provid clear communic regard ship detail prompt inform estim deliveri time track number packag allow keep track order anticip arriv packag arriv right schedul impress taken care ensur item secur packag protect potenti damag transit appreci attent detail effort put ensur safe deliveri,2
vgud cute amaz dumat rin waka yupi lng yong box wala namang sira yong loob laba lng buy next purchas,2
defect watch binibigay tapo pag nag file refund sasabihin malici activ raw reccommend buy shop baliw yung,0
faulti tri smoke juic cook get air even leak juic air intak,0
masarap masarap masarap,2
unit arriv intact good condit even box function well appar defect sound also heard loud clear,2
realli good connect app good naman gumagana white maganda yung product also magagalit mo talaga app freebi exact one thought nakakapanlumo,2
disappoint defect chinarg namamatay rin ayaw gumana sayang pera listen feedback one bought ahead,0
good valu money worth metal well pack complet order nice worn,2
wow wow like much mabili deliveri,2
fit well watch valu money afford good qualiti nice packag fit well appl watch deliveri date expect good qualiti alot color select,2
nice cover main watch small,2
qualiti good item ship immedi kudo correct order well pack damag definit order,2
okay nice valu money ok photo video relat actual item nice deliveri took okay order,2
valu money super worth nd time order super satisfi custom past deliv order,2
sobrang ganda secur secur item,2
item arriv time great condit damag defect detect complet order receiv overal satisfi custom sure order excel qualiti keep,2
lock mechan look superb valu money cheap afford price feel like felt paper made qualiti materi ring lock look secur case thick made robust hole charger indic light point good valu money,2
omg realli love malaki lng ung case nya ung strap lng gnamit,2
sulit tlga puff plus bese umord binigo maayus packag bix n bubbl wrap secur talaga packag uulitin po uli makahabol uli sale,2
cola flavour realli good,2
valu money good thick ok thick u need press harder touch work sometim motion sen wont detect though yung benefit naman nun mababasag pag nabangga protect sya talaga forget fact question doc villa right one time imo,2
malowbat use day straight without charg bluetooth call amaz also easi sync phone io lot watch face choos pack well origin recommend famili friend bec good reason price got sale happi,2
great batteri life great use month work great batteri life last week mayb week half power save mode zero issu recommend,2
omg nag hehesit bumili legit legit po itong shop pag buka buka mo phone bagong nabibili mo mall mall nung bumili nakaraang linggo walter shope huhuhuh lang nakuha omg sellllerrr kakatuwa,2
valu money,2
look durabl valu money afford look good realli love color textur comfort fit well easi use,2
okay naman maganda naman item parang lang yung dalawang clear case sana lang magtag yung case,2
ganda talaga origin po super ganda super smooth oppo shopp oorder ulit po next time,2
final bought watch eye long time display super clear high qualiti also love lot cute simpl display choos tri featur far seem worth buy,2
good good good suit purpos nice worth u,2
alreadi receiv order complet tri yet busi day hope work coz saw major good comment rider,2
good best valu money yes much fit well watch realli love order color soon,2
expect arriv th week jan luckili arriv almost day product legit got cheaper store physic store avail pre order payment first well transact conveni product origin,2
much complet yung case strap pic sakto watch order accommod,2
valu money smooth fast transact high recommend order,2
work well appl watch sport seri mm color light pink bad price medyo tight yung first part goe top,2
okay superb size qualiti contempl month gon buy plan use work unfortun otg applic still simpl offic app done seamless realli love color littl regret buy lte one,2
suit watch well order last februari ship last februari receiv today march,2
valu money wrong item slim black,2
superb camera sturdi great buy order hope nextim freebi secur packag,2
maganda valu money worth mukang matibay napashalaa worth mejo matag dumat sinc oversea sya nanggal mabigat prang origin order,2
great packag correct flavor work nakakatuwa kasamang lanyard yung juci punk buy shop,2
valu money ok ok ok excel qualiti accommod well packag item ship immedi order,2
gooodddsss goooddssss good sya nasubukan mukang ok naman kuyang rider picturan antok tulog puyat kuyang rider,2
good color valu money afford lot,2
rubber cute valu money super sulit one best purchas super cuti product like simpl monochrom good item ship quick,2
valu money good good good realli fit xiaomi redmi watch lite afford good qualiti realli like happi purchas,2
good good mabili,2
sobrang ganda super light nya pocket size sobrang good legit nagustuhan gf sobra yung oxva sobrang ganda,2
excel valu money excel excel perfect fit take photo use definit order kudo,2
log smooth touch screen issu tablet good qualiti easi use good kid work well bought daughter like much po send pictur ship shope god bless u,2
love,2
repeat buyer complet item receiv good condit good qualiti afford price,2
excel afford excel receiv brand new authent undamag complet item item look feel work expect neither cheap pricey overal geat buy,2
super fast transact uulitin,2
nice good color legit nice item realli love god bless keep alway honest client especi far sale come advanc merri christma,2
pictur video relat item ship immedi well pack secur complet item rider nice friend high recommend shop,2
alreadi gave strap mom actual pictur rider safe deliveri,2
love item sleek eleg howev still vouch longet sure long color fade magnet work well sure there reaction sweat,2
shope rider good servic safe fast deliveri receiv right order right copor size bracelet like well pack damag freebi glass protector watch wipe god bless alway power,2
mabili n pagdeliv order good qualiti item order soon recommend shop friend relat,2
valu money yes great magnet deliv fast secur new clean great condit correct color specif,2
wln kd c pocket size walki talki w two way radio clip fast deliveri item look good parang laruan lang mukhang ok naman hope ok,2
nice design great qualiti great leather qualiti love item great qualiti cheap price downsid took long time deliv sinc oversea item look expens receiv correct variant definit order,2
like amaz nice first realli hard understand discov actual great amaz,2
easi appli excel valu money excel good qualiti product phone easier hold,2
good fit watch valu money good safe fast ship product came damag product good price fit mom appl watch seri mm stream super svt,2
po maaayo maganda item mura medyo mabili deliveri god bless shoppe order,2
work well legit took almost week dumat good work well gandaaaaa ma mura kesa actual store bibili legit wala lang invoic receipt kasama pwede nanan magrequest thru email,2
nice nice valu money worth wait nice po mukhang mamahalin oorder ulit ibang kulay paiba kulay kolor damit bah hehe,2
malambot strap comfort isuot perfect combo spigen case cover maganda rin shade color bagay color watch,2
look durabl appropri size valu money worth price sale come,2
valu money sulit naman okay strap easi put good qualiti consid afford might order soon deliveri time,2
maayo transact excel qualiti valu money good bundl murang paninda fast transact nagdeliv shoppe,2
nice nice nice tea gone cold wonder got bed morn rain cloud window see even could gray pictur wall remind bad bad drank much last night got bill pay head feel pain miss bus hell today late work even impli might last day call bad bad,2
nice valu money worth maganda naman kasya smartwatch masikip mm,1
tab legit first kinabahan ayaw buksan nang courrier trust cya lang yung mura dto pilipina mabili deliv order march dumat march negro wait pko mura yung pen,2
good good sad smart watch okay better noth good price though imagin buy take struggl set time first press long press yeah set watch order buy take total watch btw,2
ganda valu money sulit qualiti bruh shop oversea howev receiv order within day consist updat status order well,2
thought waterproof heck,2
best valu money super sulit maganda mdami shope napakaganda nito sulit oorder ulit susunod mdame refer friend buy power,2
good damag gumagana naman po item n dumat,2
legit super dope good good flavor dang awesom star order,2
valu money fit se mm perfect ganda color almost origin strap origin one left manipi lang sya konti nabili sure akong madala magagamit,2
origin samsung galaxi phone nice look eleg batteri super tagal malowbat ship immedi arriv advanc time,2
pedomet heart rate measur complet item work super nice buy cheap worth famili happi satisfi much,2
function percent work slim fit pocket receiv deliveri date legit order,2
good good good good cya sana lang carton box cya ngaun cyang gamitin q lang alam bluetooth cya pwde pasahan sim,2
order last januari ship immedi februari arriv last februari much,2
valu money bagay price excit use yehhheyyyi pink life heheh arigatou,2
expect freebi cord protector random sent blue one fave color gon use well,2
u love fit fit xa iwatch,2
nice color valu money worth excel realli love strap color beauti order mani time store deliveri fast complet item order color next time shope,2
film protect watch scratch kinda tricki put,2
good valu money worth durabl order much maganda matibay sulit pera next time maram,2
valu money sobra sulit great qualiti simpl eleg job naproprotect nya yung watch pag napapatama pinto date nya protector simpl lang sya maganda,2
nice starlight color there littl bit factori flaw bothersom fit well mm seri watch,2
legit,2
item good condit fit appl watch well silicon materi good qualiti soft smooth definit order,2
receiv product good condit ganda starri night mat black minimalist yung style plus come free wireless earphon qualiti sound clear camera alreadi tri zoom meet work perfect,2
good qualiti valu money grabe worth wait tlga order ulit makompleto kulay binuksan agad super excit,2
valu money ganda po freebi sana nxt time po laman ma sulit,2
love legit item fast deliveri ship bait definit buy shop much po much shope legit legit item grabee amaz super fast deliveri,2
eleg look valu money worth price good realli love look sleek eleg realli suitabl special occas super nice love,2
happi order item came good condit defect ship within specifi timefram,2
item good except screen protector damag,2
good nice good first time buy worth price nice item good qualiti even worth price good satisfi product think buy futur regular custom,2
valu money nice protector good worth naman price fit smartch watch kudo raider buy,2
nice good qualiti price mabili sya item receiv good condit work well need like previous convo,2
gb sobrang bili deliveri sulit pera plus discount gaya sabi dame freebi grabe sarap gamitin lalo pag singer need mo malak lyric,2
receiv item alreadi pack deliv proper scratch damag alreadi use im satisfi item hope last forev use valu money much till next transact,2
maayo pagkaka pack nakabox yung temper valu money sulit saktong kapal phone case accessori mabili ship complet item confirm pic si iship yung item,2
get brand new tablet worthi surnam lai natanggap item good condit damag shope fast ship great phone,2
receiv item good condit damag well pack take long receiv parcel got excit arriv nd time order store excel qualiti iwatch accessori fit perfect iwatch,2
much shop deserv five star prais excel servic product high qualiti item pack well ship immedi kind realli recommend shop,2
determin determin authent authent verifi oxva websit accommod secur pack seal order ship receiv order need power,2
nice packag discount although littl pricier shop sure authent issu,2
arriv short order ot seem legit sinc stuff box except ofc juic like sleek design cant wait tri first time,2
hirap kausap nakikipag communic maayo iilan gasga nadin gung devic u see video kasya sinulat duh budol nag order devic phantom th gen gumagana nag refund nag promis next order isasama parcel yung replac devic ngayon dumat yung inord pod lang padala yung replac devic wala irrespons,0
hubbi love except lemon custard ita sweet tast thought plain lemon flavor anyway item complet damag leak good condit definit order,2
complet order great item qualiti satisfi definit order keep good work job,2
valu money gon buy soon must tri product fast deliveri receiv item complet natrtri feel oo kakasya naman,2
great flavor great still amaz sinc second time order receiv item next day order,2
super legit ganda design like lalo nat nabili sya price drop last pc yung color purpl minak sure makukuha sya satisfi custom follow lng yung sale invoic sinc yung purpl lang nag warranti slip kasama buy,2
legit legit yet test noong duda legit yun pag bili onlin maidedeliv maayo dumar kabado rin gift birthday mother saya confirm authent clone phone next time order uli accommod respons till next order,2
adjust valu money worth price good maganda toh ksi adjust ing strap color classic tri use tho would definit recommend product,2
favorit purchas like come strap case feel like downgrad version origin appl strap weird plastic smell still good buy price,2
like strap order item pack secur got everyth good condit problem encount,2
valu money good valu money definit worth buy feel cheap smooth finish smooth touch great build qualiti tough semi rubber materi window clear remov plastic film side color also excel,2
narec kona po nung super secur nya naka box dobl yung bubbl wrap sinadya talaga rate late inobserbahan muna yung item pambata lang ok sya price matag sya malowbat legit yung freecas face shield po,2
nice color valu money ok good sayang kasya watch,2
good qualiti reliabl mi band differ style fit differ mi model nice packag accommod good job,2
smooth camera yet test sinc lang feel okay naman legit bato makukuha nyo bweheh mabait si rider much edit review soon photo video,2
good good good nice,2
watch strap valu money good good good item,2
love accessori valu money worth sobrang ganda buy sure super good qualiti eleg accessori appl watch seri,2
bling valu money worth good st time order disappoint case super nice mabili ship buy case shop,2
magandang tablet suporta halaga pagtatangh talagang maganda mong gamitin agad nitong natanggap bili plate ok problema panonood tv ah problema laro larawan maganda kalidad tunog maganda,2
free valu money okay okay expect freebi anyth free welcom also super cute,2
strap thick look durabl perfect fit colmi watch deliveri fast secur much,2
okay okay good qualiti haha let grow togeth know matur enough commit mistak get immatur pride plea stay let haha help becom better version ourself let accept other flaw imperfect haha let grow togeth know,2
look eleg valu money overpass expect look expens proce good good qualiti like design qualiti item suit midnight blue iwatch perfect best watch protect reason price,2
okay lang class product fit hand fashion function man mejo lang sensit touch screen,2
natanggap item maayo naka pack naihatid napakabili makina dumat nang depekto oo gumagana nang maayo nagkakahalaga higit presyo nag order pangalawang aparato napakahusay inirerekumenda shop serbisyo natanggap,2
nice qualiti fast transact,2
fashion valu money yes superb order need order fast deliv say anyth,2
buy origin cheaper version love orang blue combin qualiti good ship fast,2
e kabit best qual valu money bili kana mura lang estitik ug kulay neto laka maka sosyal medyo matiga lang e instal relo,2
valu money worth price excel qualiti come tool adjust metal strap bracelet everyth perfect,2
sobrang bango worth binayad mo,2
secur pack receiv good condit though took three day proceed shipment one expens buy shope anxieti wait patch deliveri servic j express effici,2
send wrong color sarisfi,0
good qualiti product price fulli function definit serv purpos high recommend,2
husband like chang strap case everyday materi use also look expens,2
good naman mukang origin naman model afford good sulit naman binayad mo good thing naman scam,2
item order ship day receiv nagsend pic b pack send packag well pack bubbl wrap qualiti item legit see pic seal plastic box un lang ung cartridg taga nd open ok naman sana ung maayo,2
good power chipset good legit super good pagkakabalot madadamag loob box medyo matag lang worth wait guy sobrang sulit phone price lang grabe realm team kudo shope,2
time good okay maganda sya price siyempr tri waterproof mawalan smartwatch also mafi figur buti okay naman,2
valu money nice good ok excel qualiti item mabili naship narec agad accommod naman smooth transact well packag damag maram po,2
packag valu money undecid good okay naman lang ayun binawasan yung frame pala kasya pwede rin kesa wala,2
love realli fit appl watch se til next time,2
highend great customiz ship right time packag secur packag item product review complet damag qualiti great serv purpos custom servic good custom servic experi satisfi total rate star power,2
good cheap good good order sever time alway happi deliveri expens origin relx good shope,2
good ok ok luv,2
camera good st time cp buyer onlin item receiv good condit order get recommend mahilig gumamit samsung phone,2
maganda ung batteri ksyang kasya smart watch slamat shopp,2
good good valu money good well packag kopa e tri watch item ship base gale sana ok watch,2
batteri durabl maganda camera legit oppo nice unit kaso walay freebi headphon unya wala back ga download pako unya ug mgtype ug msg dugay write ok man ky back phone akong paninda dili friend use unlik huawei ug samsung batteri ra akong apa ani puhon unya magdugay pud krn pako nag,2
good good heart rate blood pressur item good abl monitor heart rate blood pressur,2
super happi purchas use day must say love also order screen guard addit strap one sulit buy super bili ship andito cia day batteri still day without charg,2
sorri late rate shop first test cellphon work first time bought store afraid might ruin damag broken base said glad got good condit origin guarante legit shop,2
tri alreadi work although sound loud like expect ever lost valuabl use u might find well sure batteri replac sure long last,1
microscop camera fiberglass leather edit g wide angl camera microscop camera expand gb ram love enco bud freebi solid bass fiberglass leather superb madal hawakan madula fingerprint got php gcash rebat oppo recommend get one,2
yung mismong item valu money worth price sobrang ganda mukhang mamahalin ganda gosh safe safe relo uulit worth wait,2
premium valu money reason itchi wrist sulit sulit pang premium talaga qualiti strap nato compar rubber nagshishin shimmer hahaha,2
ganda grabe yung kulay pansin pansin tao yung strap mo haha,2
reciv diko alam anong size hahaha ok naman,2
complet item damag parcel excel qualiti right variat choic well packag well secur,2
adjust strap good valu money okay,2
great easi use nice price magandang pang gift kid sure magugustuhan panalo narin presyo,2
good tast good order receiv send photo love flavour well pack secur definit regular custom shop,2
excel good po legit po talaga maayus pagkakabalot bili dn dumat uulitin,2
nice product hope matipid ganda,2
durabl perfect receiv item yesterday good condit naka bubbl wrap medyo nasira kunti yong kahon maganda safe naman item mabait dn c nag send pictur nong item pina ship god bless po nagustuhan naman nong nagpapabili,2
ok naman gumagana mabili lang naman maful charg hr lang sure hour work yung full batt ginagamit brother ma maganda yung black nito meron black red yung kapatid,2
good good good nice kid total love,2
deliv time nice item good qualiti complet order definit order well pack good job,2
packag secur ship day order place respons messag product good tip buyer buy get choos free pod flavor check add option prior place order,2
youuuuuu sooooo muchhh came earlier expect good qualiti complet,2
cute job well naman excit use phone think exact card holder masikip keep mind,2
good price screen protector affect touch sensit fit well job match sporti strap ocean strap look realli good suit daili use pictur justifi though magnet stralight loop strap elev watch look sporti formal comfi wear though courier arriv day earlier expect,2
ok ok valu money ok excel qualiti accommod well packag item ship immedi order,2
queri hesist chat kind respons swear second purchas glad fast smooth transact god bless power vape mall,2
best mabili ship maayus pagkaka pack item godbless power po shope nyu npakamaram perfect,2
fit well gumagana pindutan addit protect receiv free plastic screen protector bought case naninilaw updat mabili manilaw,2
look like origin strap doesnt feel suffoc co masmanipi compar origin appl watch strap yung materi parang appl ah tbh,2
video relat strap aesthet realli love comfort,2
eleg classi valu money worth stainless millanes,2
valu money good qualiti afford price fit appl watch color need expect size correct color accur,2
maganda valu money oki naman price oki maganda midjo mahirap lang yung watch heheh order ulit shope raider,2
built phone magnific well protect disappoint nung time pinurchas yan naka display free q smart watch time yun freebi mean order hour origin purchas time could smart watch anoth thing sad earphon includ inclus asid smooth fast deliveri,2
great mura orig alway pod look good hope work deliveri fast item pack well send correct item sure order soon,2
great item got wat want great great payat wrist like good qualiti ung rubber nya hnd sya makati look expens super cheap lng nya,2
good qualiti walki talki work walki talki work pusit walki talki set chargeabl walki talki best walki talki,2
dumat good condit yung watch medyo yupi yung box okay lang naman affect yung item maayo ganda kulay mahirap lang pag setup nakakalito,2
nice best excel hard follow dream requir great decis sacrific sometim end lose someth cherish sometim love one end greatest happin seek success career share one love,2
heart rate worth buy sobrang ganda delay konti yung deliveri safe nmn syang nakar,2
legit work yung ht radio sakto naman info nakakasagap transmiss base station km brother inc balingasag repeat gagamit uv r ctc dc code search niyo nalang rant gumamagana,2
love qualiti seem like origin,2
superb perfect valu money awesom definit buy anoth band much,2
love order mucchh love order mucchh love order mucchh love order mucchh,2
color valu money good good well pack nice qualiti beauti color choos ship right away buy,2
got order see get receiv good condit well item well packag courier rider til next order po,2
nice good star u relx yung relx order bali order black green maayo yung item damag masarap yung pod free ayo star yung shop oorder ulet pag nagkapera igigift naman kapatid,2
item pack secur deliv safe correct item deliv fit appl watch seri,2
transpar easi instal valu money realli afford option seem thick enough protect watch prevent scratch dent side,2
valu money good good good,2
valu money worth good qualiti perfect fit smart watch po order,2
good qualiti valu money good good sobra bili nadeliv agad tapo good packag nice qualiti order uli nxt time,2
legit pastri vapor layu nung flavor hagod legit pastri vapor pakla nito wag bumili pack palang plastic bottl ibang photo nilagay,0
vgood vgood vgood john king jame version mani receiv gave power becom son god even believ name born blood flesh man god,2
good dabest servic napakabili dumat maganda product mura maganda soft touch sya gamitin,2
