comment,label
good natra tri ganda po pang awrahan subrang sulit sulit pera h strap watch mabili date haap,2
ok good good receiv last feb ngayon lng rate kc ino observahan far ok nman phone matag malowbat maganda actual anoth one soon,2
item receiv complet nagagamit nasuot matag fit naman watch edit review tri,2
pist awa tong super poor poor putang inang sller mang lolo hr lang lowbatt tapo sabi samsung galaxi refund guato ibalik tong item tapo cancel mo kawawa yong pera anak iniponan tapo ganon lang,0
freebi si solid legit ung juic legit mabait si nagsend pictur isend pafreebi xa tester sticker order soon pap,2
bili ship maganda pagkakapack andam bubbl wrap maganda rin qualiti mura hehe,2
good qualiti valu money fair good,2
excel item qualiti complet order fit earbud perfect item secur pack box individu ziplock type bag ship item immedi even sent pictur ship total worth,2
tri yet good respons chat also deliveri except quick order,2
valu money good serv purpos nice product case pick lock babi open also deliv fast,2
nice product realli work easi set long follow read attach manual refer overal good naman sya,2
secur valu money bang buck excel item well peck bubbl wrap ship time took awhil transit main courier respons happi product kudo sure purchas item shop,2
maganda po shope also rider babait uulitin po,2
aesthet valu money yes design awesom yes case easi becom accessori simpl eleg piec mix match easili,2
order ship receiv item correct complet pack individu pouch,2
though manipi least kasya relo fit wearhealth smart watch valu money swak nmn budget magkakasya nasira origin strap nito buti nalang nagtri umord happi satisfi,2
excel qualiti accommod valu money item ship within estim date order need deliveri,2
maganda cheap price,2
super like good condit variant order sure buy look durabl,2
good nice good price qualiti except fact beyond expect even though read review provid excel protect look fair good anyon buy brand name noth fool anoth great thing whoever design made boot head screw proper came adher uk shoe size order got fit perfect insid fair comfort stellar within time foot harden put thick pair sock big dealio top product high recommend,2
color valu money worth money color cute realli look person gave right size,2
camera best good realli fast transact pinaka mura pinalampa much,2
easi handl excel best first time buyer nagustuhan tito nagpapaord ulit kaso wala stock cool mint secur item,2
valu money good good good got order appl watch case appl watch seri pc hard matt bumper mm mm mm mm iwatch protect shellit ship immedi well packag,2
good superb sana magtag first time buy product test okay buy husband son plan buy also infinix zero,2
lumin easili find watch dark valu money good okay price pack well complet item sure buy shop purpos protect watch scratch,2
great phone afford price mani time order shop never disappoint legit great job kuya rider god bless much apologoli late review,2
good qualiti legit sent photo ship ship order right away receiv ahead time plan order shop power god bless,2
maganda,2
anga design legit youuuuuuuuuuuuuuu definit order high recommend,2
valu money reason price true size good look legit da product naman n durabl definit well order color shope u mr rider merri christ ma god bless,2
legit legit product recommend mrami although natagalan maideliv buy,2
order correct complet took sinc oversea nice price abl use harder appli temper glass good letlenilead,2
origin good,2
cheap look plastic valu money high qualiti nice protect iwatch scratch realli well arriv condit,2
valu money worth great maganda yung item sayang pera nyo make sure lang tama yung size bibilhin nyo buy need,2
great qualiti valu money worthit perfect thick thin gift im sure comfort still nice strap look expens,2
first watch work proper week use connect bluetooth keep freez access everyth tri restart restor factori default howev problem still persist alreadi contact respons recommend buy item,0
mukhang ok nmam p n tri good nman wala nman damag sn tutong water pr f,2
high valu money high strap love happi receiv parcel complet undamag,2
good easi use stylish nice color im satisfi im happi product cheaper price,2
product ship ahead time nice howev like packag realli anyway qualiti product realli ensur legit smartwatch capabl display time monitor one step blood oxygen level heart rate blood pressur mmhg,2
good valu money good excel super coz wrap order proper temper styro arriv good condit order correct what nice shop give free cellphon holder order shop keep good work god bless shop,2
talaga yan yong color vape kona sya napic ayan yong unang order,2
valu money worth price item nice free tool adjust screen protector,2
ganda nung product saktong sakto smartwatch comfort lang suootin tapo parang naman madumihin,2
valu money cost effect look great sturdi look great like took long time arriv worth wait,2
fast deliveri ung ship nirefund peso lang naman nakaka sad parin ung parcel,2
excel tripl camera excel good budget phone lalo daddi pang lalamov basic soc med lang ginagawa everyday life,2
good hope last lookalik good watch lot featur sporti featur give good feel remind thing need,2
nice thick protect watch valu money valu wise realli nice cheap price realli protect watch scratch,2
perform good sleep monitor step count great item arriv earlier expect day rin nalolobat watch use heartbeat step count sleep monitor everyday various workout motiv burn calori everyday happi purchas hope last long,2
sobrang ganda worth bili guy perfect huawei watch fit,2
complet order well pack legit item afford price im happi purchas sure order shoppe,2
good high qualiti satisfi order,2
le price choic band strap nagdeliv aga,2
nice best good first place go tri find product servic easi googl also natur googl best site onlin review googl especi signific local busi make sure spend time set googl busi profil make busi discover,2
mabili deliveri well pack yung item tape yung takip leak pangalawang bese yata bumili beke nemen joke,2
,2
nice one love item though select serv purpos anyway colmi hope choic app,2
order strawberri ice cream worth php gave taro ice cream worth php gon buy store,0
ok bubbl wrap secur ok order receiv bili tnx nxt time tight wrap kc deform ung box vape bka mabenta tnx,2
screen protector valu money excel good damag item strap bit short manag like screen protector valu money,2
good good good noth much say one use good qualiti im give star,2
valu money good mukhang matibay makap super good super nice matibay makap medyk matag lang nadeliv okay lang,2
color valu money oki price product nagustuhan po thankz en rider ulit po order sususnod transact,2
nice child love legit well pack fast deliveri,2
proven test good amaz nyo po binigo high recommend shop po talaga god bless po,2
valu money good goood good order complet dumat man nan maaga sulit price kuya rider po,2
receiv today im excitd use xiaomi lite watch protect worri scratch whatnot much order happi purchas afford,2
leather smooth clean leather strap thin jot thick also soft,2
first time tri puff plus sinc use relx alway trust shop caus know mad master legit flavor sakto lang higher nicotin level usual pod siguro rate mango flavor malaka humipak dont know long last u mm,2
great access app exceed expect batteri last day depend usag provid easi access app messag health camera music etc notif help especi busi,2
worth price amaz octacor processor super fast perform legit oppo mobil phone shope safe arriv order bought haha love oppo ever sinc meet expect usual good job oppo store power legit legit bili guyz,2
design valu money fine like keychain abit thin like addit batman freebi keychain much appreci,2
gotcha super ganda nagustohan asawa magaan lang sya afford nakuha syang sale kausap si bait u much po,2
good item fast deliveri,2
look lux valu money good good leather quick respond inquiri ship immedi got le week color also deliv correct damag individu pack kudo po although leather band hard time remov watch scare might get stuck thank abl remov,2
work perfect partner drag secur deliv wrap bubbl wrap definit order respons queri kudo shop,2
textur valu money great good qualiti item complet correct variat po nabigay mabili naship mukhang matibay maganda qualiti,2
nice high awwt sarap fresh red grabe buti nalang kasama devic high five mellow melodi natikman yun brother masarap garden heart inoopen sure bibili accomod giid item,2
confirm receiv item complet good condit good qualiti order ship schedul well pack much accommod keep safe alway,2
dissapoint thier item co z fit watch,0
maganda yung product mejo matag lang talaga yung deliveri inabot linggo araw akong naubusan wala namang problema binuksan nyo last stock nyo order agad maka habol,2
color great great ganda color,2
realli love item immedi ship son use onlin school much,2
item good price see also get person kudo high recommend shop,2
camera guess good observ fast deliveri bubbl warp complet accessori lowbat lang sya nung dumat edit review use shope,2
good good valu money good ypu love orde,2
expect get screen protector okay strap darker pic good naman color combo realli cute probabl gon buy anoth one,2
still observ maganda malapad mukhang matibay naman worth price sobrang laki bawa voucher still observ talagang ok app edit nalang masaya yong nagpabili birthday gift anak sulit sulit pag ok order ulit spaylat da best legit po order pala gulat lang wala palang charger head ok lang nakakapanibago cabl naman ok rin,2
product authent also abl get cheaper price srp pretti happi fast devic ship deliv beyond box,2
poor fake mura leak poor none leak pahiya buyer ung hnd gumagana pla pangit pag mura lng safe trust,0
case trap valu money afford cheap good arriv earli expect like matt color freebi got holder iwatch charg cabl,2
valu money yes fit gale oversea item super nice qualiti nag silicon order,2
wrong item umord gulaman lang inord blueberri ice mango sana check muna yung item,2
nice band although physic appear far authent one still serv purpos good qualiti,2
cute color valu money worth nmn screen cover fit watch total good total fine good thing screen cover either screen protector fit watch,1
order last receiv product well packag good condit fit perfect watch,2
fine ok good,2
,2
grabe natakot yung case binili shop mapindot yunh screen iwatch buti nalng napipindot sulit shop ganda product eme,2
set valu money good buy nice materi matibay sya titignan laba loob mabili naman dumat sakzto lang mabait si,2
valu money worth strap good bese unoord shop kase afford product lage maayo packag ganda ba strap kase matibay tlga although etong last order medyo delay receiv yung order still good rin kase damag yung order oversea sya respons c nakakatuwa kase pwede ask sknya mo malaman product ulit,2
fair averag suit day pgorder nadeliv sakin shope tumag sana ky asawa,2
poiuytrewq asdfghjkl mnbb ayo ayo maganda perform tsaka sarap flavor ah haha buy,2
uulitin po,2
good alway display good ganda watch worth yung money almost premium copi origin tig k onti lang differ tiktok binebenta k lang bili maganda qualiti ultra watch pwedeng pangregalo,2
bought friend beauti still come headset work recommend,2
item pack nice ship deliv immedi receiv good condit charg took hr fulli charg come app automat turn phone bluetooth connect connect devic app featur seem work connect,2
good nay lasang parang tequila ba nmn tong taong haha naprank goy anyway bsta medyo lng bet lasa nya good dn nmn imvp talaga alway lng unang hipak boom wan get high lover,2
good good batteri life day dumat binili anak ml player naka ultra den ml bad makunat,2
charg flavor stale bad sorri want give chanc seller product bad,0
valu money afford nice good qualiti day earli schedul deliveri,2
deliveri fast complet case nice afford order soon much happi easter,2
nice valu money good nice mautak tong shopp pag ayaw magbigay coin sasabihin repeat text wala naman repeat,2
good color good ship hella quick arriv quick freebi includ long follow direct add gift sinc freebi automat ad seem like instruct lot peopl miss result lack free pod,2
wow nanalo waka nakailang bili mysteri box ngayon lang nanalo brand new tablet sobrang swert sobrang smooth ganda nakuha nakailang order muna nanalo legit legit itong store god bless,2
strap good condit thick color nice easi adjust perfect fit wrist courier,2
ok valu money ok ok product deliv damag pack secur fit well appl watch,2
work txt ung sim card nakakabit gps regist ta magrerepli palpak sayang lang ung pera,0
nag dadrop nalang watt yung ohm ewan da cartridg devic tama tsaka bandang airflow mejo maluwag yung adjustsan gaya unang xlim masikip,1
like need charg agad kase day sya dumat lowbat yun lng kont damag gilid ok lang naman halata kase black color mura u,2
glad abl get lesser amount actual daughter love abl connect smart phone maxim function nice item,2
maganda item valu money worth best rd time purchas accommod siyang kausap yong request color correct worth naman presyo origin naman halata uulitin purchas,2
relx fast deliveri good packag,2
qualiti high recommend shop,2
good good good item ship one week deliv fast arriv local smartwatch work perfect good upgrad smartband,2
noth chang free vape devic sure tast rich tabacco nd order free devic coz reason ahaha way dont need use vape charg coupl spare vape,2
valu money good qualiti valu money look like origin got item time fit ironi swatch watch differ model look like new,2
great long rang clear voic nice product malayo rang nya good buy sinc sya yung cheapest avail shope akong bibili,2
good bubbl wrap secur good order receiv ok damag tnx,2
work glow dark sana lang purpl white nalang pinili perfect night time use watch mg illumin,2
bp monitor changeabl wallpap basic generic product inform categori sport sport technolog wearabl sport watch calori counter yes distanc track yes heart rate monitor yes smart notif technolog yes,2
nd order satisfi custom ganda radio malaka clear ung voic thumb order,2
good storag premium packag well organ bubbl wrap protect protect give ceram big cup realli techi look,2
good valu money good good pang second order shop maganda ung qualiti pang matagalan talaga use oorder ulit nito,2
great great best amaz secur item much appreci item deliv quicker gift si law thank came quick plus freebi simcard,2
pedomet workout mode alarm connect iphon pretti good substitut appl watch want someth basic track fit x cheaper sync ok phone batter life ok issu replac strap hard remov,2
use love someon didnt like say goodby didnt use say miss one didnt hug,2
wala pang week sira ayaw magcharg magamit ganun dun yung tirang nag iisa lang yan gumagana sulit pera dispos tri bp temp normal bp nakasuot pati temp normal temp,2
excel qualiti accomod well packag item ship immedi order good servic,2
item origin valu money worth price good qualiti much happi see item look person high recommend shop,2
good fit well protect band time sensit maintain good prevent water enter band case band either way band protect main purpos serv water proof anoth stori buy,2
good valu money good good mabili dumat maganda qualiti,2
ayus guy freebi si,2
poor perform none look good connect thru bluetooth fit pro app find watch alway disconnect even connect thru bluetooth tri sync day alreadi im failur wast money need reset midnight least usw watch bec sync time phone,1
valu money item correct ship immedi bought item nice qualiti,2
great legit appl product love fast ship deliveri beyond box premium product servic shope,2
product ok good qualiti youuuuu selllereerrrrr andddddd shopppppeeeeeeee,2
superb qualiti far notabl nice fast ship fulli secur legit appl product,2
legit xiaomi smart tv good qualiti,2
k k k item arriv good condit item qualiti excel item well pack sure order lot,2
good qualiti valu look legit sturdi repurchas soon item took awhil ship deliv understand sinc oversea,2
valu money afford good color mm,2
excit order surpris sent wrong color order rose pink second photo packag red color alreadi collect sayang,2
fit mi band valu money good good packag upon receiv good qualiti accessori fit mi band hope last longer type,2
good valu money good good receiv parcel today good damag bili date ny sabay order pala,2
color combin valu money price alright bit big band medyo malaki ung lalagyan peo keri naman sinc matatakpan naman wrist,2
maganda po product talagang authent sana magtag paggamit nito high recommend price worth magsisisi shope second time order shope nsjdbfmfmfnfncslqpqieurhfnkflansbfmlfirhsksdnfnflemanskdlnflansnfkrjhdlfkfjelmdnflflfkm,2
fit valu money worth qualiti look sturdi last long realli like strap like one better origin strap got appl store masakit ma suotin hehe order,2
one best shope find satisfi custom immedi put watch excit damag fit well watch,2
much shope fast transact legit item well pack receiv good condit,2
ok tri muna tri lang gumana namn yung dalawang order,2
fast deliveri second time order shop alway deliv product safe secur first time tri extrem brand hope almost origin relx pod,2
great ung speaker superb final narec worth wait legit legit safe naman nakar yun lang ung bubbl ata yun loob box nsa tapo ung tab nsa sana nsa gitna ung tablet nakapalibot ung bubbl ma safe buy soon,2
durabl valu money good great gift like color seem durabl great day ahead,2
alam mali lagay base review nagbububbl talaga,2
ewan lng valu money ok nmn free kz sana nlng pinafre nio ipit nlng kz kalat lng ung pafre nio,2
bought vivo phone beauti design good spec reason price fast deliveri,2
item order ship day item good use definit order tri god bless,2
valu money order reciev legit sulit sulit murang halaga good packag bubbl wrap definit order store big po mabuhay po,2
valu money gud transpar good like transpar,2
help talaga naka monitor bp oxygen level especi day nate healthi easi lang naman app lang nai connect cp shope til next order rin nag deliv,2
solid pap pabudol narin hahahaha sobrang solid flavor,2
good product good qualiti valu money worth buy worth buy know price cheap order color next time smooth transact fast shipment,2
like one first time order hunter x hunter game pad nice product order,2
legit valu money sakto lang presyo good naman secur parcel nakar safe sira maayo till next order,2
good kid far good ok ok maganda sya nag send si pic e shipout worth yung price nya tig iisa yung anak away afford lang naman thamk,2
ok yung item kaso unrespons yung,0
ok best featur honest expens spec arriv day ago lang nag rate agad matest muna okay naman mabili ship,2
good stainless lanyard mabait kc paulit naga bili gud heheh sana freebi sunod heheh tnx lob u letsgo laker,2
ok ok valu money ok huyyyi ganda nya fainess love well perfect honest humbl opinion cours without offend anyon think differ point view also look matter differ perspect without condemn one view tri make objectifi,2
bese po omord shop super sattisfi buyer legit dear shope,2
item work good purchas good price nice gift amaz deal much,2
self heal work protector got dent heal later test compat bumper case pic tho made mistak instal henc wavelik print last pic notic watch use affect watch would recommend aw,2
appear good still catch move ship time fast like,2
high recommend shop deliveri fast qualiti afford mi band univers strap nice color bit hard compar origin miband strap check upload photo ur refer screen protector wipe accomod definit order,2
maganda po sya mali lang yung color natanggap gray inord black yung dumat ayo rin,2
good qualiti nice maganda gumagana charg pagpindutin mo lang late respons okey naman,2
sira po yung pod dumat sakin,0
great valu money great great parcel pack secur good qualiti item price deliv earlier expect date order shop,2
much alway best item pack well deliveri fast sure order,2
sleek easi use good excel,2
medyo matag dumat yung item damag secur yung item maganda mukang matibay sana tagal order,2
valu money good good ganda,2
nice fit valu money good valu money excel,2
fit watch perfect nice materi like origin valu money worth price fast deliveri complet happi purchas buy,2
excel best order april receiv april total peso voucher free mug nice cellphon sobra ganda wide screen fast charg kakatuwa aesthet color laka sound okay secur featur activ email address mo free mug ata call center niyo agad agad nasagot inquiri origin legit huawei cellphon sobra gandaaaaaaaaaa,2
valu money sulit good adjust rubber cotton pala maganda sya mahirap isuot naman gamitin got correct item also pack neat buy soon,2
sana nyo po pinadala saakin yung parcel icheck niyo muna gumagana po ba fair naman kc sayang ung pera binayad po item eh tapo sira pala yung matatangap excit naman akong gamitin os gicharg wala talaga,2
valu money yes good color textur ganda product medyo matag lng dumat worth,2
color ok valu money great receiv item good condit naka individu pack loob parcel bubbl loob lukot parang carbon fiber black expo blend watch buy oc gasga like,2
kala sakto ung strap niyo kaso ung takip naman problema subrang liit gumagalaw ung switch nag hang strap problema bumili nd ngayon ung case nmn hahahaiiiiii ok nlng pag tyagaan bili nlng,2
mabili dumat tri,2
valu money worth splendid qualiti product super great see photo amaz qualiti,2
excel ultra wide camera fast charg hd display best oppo reno seri origin authent legit best reno seri far camera qualiti good display accessori complet freebi offici oppo store product legit packag could improv could also courier fault,2
cool breathabl gaano kainit although egg lang lutuin medyo matag lutuin ewan sya pwede set ung init wala maluluto lagi nakaset matag rin awh kala big help sya sayang nag induct lang,2
great valu money afford yet expens wear like much buy finish review sana soon freebi hehe,2
fast ship even gale oversea maliit lang sya good qualiti p deal shope courier,2
hard case worth,2
excel excel excel nagustuhan asawa itong regalo nagsend pictur ipadala rin rider,2
excel excel excel first time purchas mobil onlin realm fail realm superb worth wait much recommend famili friend shope realm,2
magnet valu money cheapest price stainless got order fast ship secur packag second order,2
maganda yung pod nd pod lang differ color comment freebi wala kang option freebi juic ung gagamit kc nman gsto mg suggest magkaron kau option jusko prang eenjoy ung freebi n juic technic prang hndi freebi mabili nman yung deliveri respons si lang prompt unlik seller anyway,2
b valu money c need lover keep sane pull hell bring back play classic someth romant give even alway dream solemn face someon feel like holiday piec bare believ start think lost feel,2
enjoy chang pictur super ganda mabigat xa xa cheap tignan nag observ batteri life nya far matag lowbat sana tumag charger work well super satisfi nagustuhan talaga kc maganda qualiti xa lowbat manigay xa sana tumag hehe naka bubbl wrap yung lagayan nya seal talaga xa nakapag unbox compat xa ip android parang oorder uli ibang color naman merri christma,2
mabili nadeliv product safe naman pagkakapackag second time akong umord shop legit po,2
good good valu money good parcel receiv nakar maayo ngkamali place order akla watch nun order strap lang pala prblm tuloy shope kuya rider,2
excel qualiti accommod well packag item ship immedi definit order,2
nd order vape super best super legit start sya accomod legit item well pack item recommend star,2
sayang yung pod order sana palitan nataga yung diko ginamit masisira relx nataga pod yung good nman taga nanghihinayang lang peso ta mo magagamit malaka yung taga nya,0
fast ship phone proper secur shock see wala palang adaptor kasama phone great brand new seal pagdat,2
valu money afford qualiti materi okay sya worth yung price although matagl yung shipment,2
makap sya sakto lang pagkakasalpak medyo mabrown lang ung backlight sya kamukha white unh backlight syang lage naka eye protect sana tumag cellmax,2
transact fast ship item immedi item receiv good condit,2
came earli well packag came separ zip lock watch fit perfect satisfi,2
got packag today deliv place perfect fit watch five star rate product,2
legit good puff tast good top tier overal good buy regular shop benta ae bar price ok ok,2
got packag alreadi much secur order great job shop courier definit buy shop god bless,2
valu money nice item supplier free clean cloth,2
buy sya last sale day receiv earlier done expect date nd phone brought last,2
ggood valu money afford good po gaganda po case po case realm c maganda po mganda po,2
charg naman po sya nice design nagustuhan anak sana magtag qualiti,2
hard touch sya screen protector okay lang ung qualiti tela strip madula saka alam ganto ba talaga maik ung talus,1
legit huawei product fast deliveri well packag nayupi yung box item ok sana magsal ulit hehe,2
rd time order product store never disappoint much afford price fast deliveri order definit order next time,2
ok sya maganda yung qualiti bili ksi worth sya onlin len kana good qualiti also best purchas,2
auto draw mah product edit review nalang magkakaproblema napakalamig lalamunan juic hahaha solid pagkamenthol,2
nice valu money worth good fit,2
valu money great product excel qualiti magnet featur sure buy shop happi purchas store,2
smart watch comfort wear okay price hope answer call locat phone find set activ satisfi track menstruat,2
nice turn ivori watch black nice fit perfect great buy much,2
kont leak lang kita naman pictur ok naman sya masarap lasa nya po po nagsesend sya pic order nya ideliv po,2
great product pack deliv good condit work fine hope last kudo great,2
excel item qualiti correct variat item complet item secur pack bubbl wrap ship immedi definit worth,2
cool product nice color everi day chang watch strap glad bought swatch make easier dress appl watch,2
excel hardwar qualiti valu money excel except love purchas much freebi actual got worri go mall adjust solv hand definit order,2
bili deliv order receiv,2
ok ok ok okay naman user friend malowbat mabili full charg madam strap compat sakaniya nice purchas,2
