comment,label
much product arriv damag packag well work proper scratch anyth like youuu great size great,2
tri long distanc speaker clear handi radio fast deliveri rider shope,2
good excel item ship immedi realli wrap well bubbl wrap definit order soon,2
menthol love super legit sellwr nd tym order dis shop,2
super ganda phone much high recommend everybodi especi peopl love take pictur super ganda camera presyong afford excel qualiti,2
stay matt unlik origin strap valu money great great alreadi tri product far good feel itchi unlik origin strap sweat like much color variat purpl navi black hehe,2
got packag deliv time courier check packag okay bubbl wrap item describ happi transact everyth went smooth deserv ten star till next purchas,2
shope review item arriv day ncr area item bubbl wrap w sever layer pack bag item complet good condit work proper fit well miband insert insid rubber lock miband insert outsid clip lock think cheaper price includ chain link remov tool,2
style valu money qualiti excel fast deliveri good packag afford price good item order,2
valu money omg receiv complet happi purchas u,2
product cours valu money great good price man thought hole earpiec would bee littl big fit perfect,2
long wait final week wait time xiaomi redmi lite smart watch arriv yay excel qualiti yet afford easi set use mi fit app option transfer data xiaomi wear lite app,2
okay okay okay,2
valu money fair fair fair ok lang yung product worth price nya,2
receiv faulti item last april submit report shope item faulti batteri drain quick everi minut connect phone bluetooth yet control music featur submit proof also return item inspect item reject return item disappoint,0
good qualiti fast deliveri corni lang rider think funni bug text say ibabato nalang yung parcel,2
item ship immedi item good condit receiv incomplet item screen protector,2
comfort good qualiti rubber materi valu money super valuabl money happi product comfort wear buy,2
dent valu money sakto good naman secur parcel dumat kumpleto sira kaso strap lang nagamit hous mismong relo,2
valu money deliveri quit fast packag good item complet good condit hope last long,2
nice nice nice hey gomo fam glad inform system activ new sim add data use mo cred log app websit much patienc stay awesom,2
amaz camera charg speed amaz legit super satisfi use week wala namang issu would like commend superb packag parcel high appreci plan buy phone shop still hesit sign go checkout naaaa,2
relx item legit price reason actual count mani time order shop lot,2
color price better good late review busi schedul nice product work complet accessori shop accommod much huawei store shope courier kuya deliveri rider job well done po,2
ok naman valu money ok price ok mura sya good naman sya ao charact need ok naman sya ok sya charact ok,2
sound good good test power good condit loud beep sound still studi learn use yet instal tracker cellphon hope keep last also replac batteri drain deliveri driver shope,2
penk good valu money yes freebi,2
po magalang mabait deliveri rider si mr andro piamont lage ngdedeliv parcel gumagana po oorder po ulit,2
ship time manner mabili naideliv via go watch user friend built gps music also use spotifi youtub music batteri life exceed expect,2
valu money lang match ung bilog button mapindot masikip ung strap pag ipapasok nasisira agad agad pumapasok ipilit idiin fit good dumat naman safe completo,2
far good valu money like magnet offer solid grasp loop appl watch feel safe rock around buy irrit skin got today,2
nice qualiti valu money worth money pay nice color love durabl product handl well deliv earlier,2
doubl thumb po solid solid worth nagustuhan po malinaw camera sana yung feel nya saken ganda nya game sana nya pinaglalaruan laki storag sana parin laman puso isip nya nagustuhan sobra sana rin n,2
simpl easi match cloth valu money good l okay look like last long individu pack ship time complet item,2
need buy shop give inconveni take action mistak put zero star one star much reciev,0
sleek tlga design iq dispo best masarap flavor fast transact bili naship sakin buy,2
okay yung product lang maayo magpack yung,2
percent legit po valu money good price worth po legit,2
yet tri ao dont know design vape cool hope work well last long good deaign vape littl big dispo,2
super nice legit size perfect budget friend high qualiti must,2
jnt lang sakalam mabili serbisyo ung item diman nagana relo,2
color good good first time order model medyo nanibago pag start pala start pag wala wifi data insert sim pala style phone nato,2
easi place valu money super worth beauti easi replac old bracelet one look eleg nakakahappi,2
one million camera pretti item receiv first time order ganito kamah nakakatakot scam hahaha super btb shope super bili lang dumat buy legit good discount,2
speed great sleek slim lightweight sturdi secur pack physic damag found first mom want return resolut camera compar samsung insist phone lot good featur love mayb expect much mp oppo cam im keep phone anyway freebi definit good deal,2
maganda po item sulit pagkakabili item ship immedi excel qualiti accomod well packag,2
never thought product would exceed expect ndi nglalag son abl download app quick satisfi product hope would last long enough kid enjoy sale come,2
good cute nya bili dumat ganda ty order black green tama naman kulay cute nya,2
good good good shope hope tumag tri bz hehehh sunod nlang edit pag maganda tunog nya,2
okay product price say good okay product price say good like uou muchhhhh sellllerrrrrrrrrrrrrrrrrrr,2
arriv quick parcel came box thick bubbl wrap test product right away issu far good arriv quick parcel came box thick bubbl wrap test product right away issu far good,2
medyo maluwag kin ung medium bought small lang still nice buy mura shop fast ship,2
second time order shop good qualiti satisfi regret buy product shop sure order u,2
fit watch valu money cheap cheap product fine button wheel attach well also tend scratch watch wear tear still serv purpos,2
wake good monitor muna ok mung defect deatbat lang pala hulog nung deliveri sana tumag pang regalo naman jowa,2
item complet mejo matag dumat order surg eversea naman good maganda yung item fit well freebi,2
sinc shop far take time arriv given holiday season still receiv parcel,2
receiv item good order condit pack bubbl pouch make item secur work hope last help shop high recommend shope,2
storag excel nice secur pack deliv right away first hesit place order sinc quit risk consid gadget hat oppo shope mall secur order includ great freebi expect came oppo bud love good job oppo,2
good verri good verri good nice kuhang kuha iphon,2
okay lang price charger cord okay far matag sya malowbat kaso lang charger cord meron okay lang hanap nalang ulo po,2
good easi put phone valu money verygood color actual red origin color iphon maroon matt still love blue purpl well po shope,2
gb memori great type c better imagin work fast cheap safe packag arriv great come freebi,2
poor counterfeit product alam ung review legit tong product wag kayong magpaloko fake chineck websit geekbar ung code nagana naman want niyo legit product yon advertis copi lmao,0
valu money worth nice case featur product great cheap worth fast deliveri sure buy,2
god good pretti matag dumat sobrang smooth transact complet good phone nabili vivo,2
maayus packag maganda qualiti item sakto yun strap tama kulay medyo matag worth wait nman much,2
good condit bubbl wrap suit descript maganda product arriv good condit nakabubbl wrap maliit matag lang talaga dumat order jan dumat nang feb order rose gold ma ata pagkagold nalito color overal maganda item good condit worth naman po po,2
valu money got discount good good arriv expect date qualiti good though realli like shade ok xnan use formal occas,2
fast ship valu money bit expens guess tip rang price okay arriv faster thought,2
cute color valu money super hard touch,2
ok naman yung color pati yung wrist watch size yung pang cover bukod sira compat maliit,2
valu money good good good mejo matag lng worth wait nmn ung product purchas sure mura maganda nmn god bless sate,2
pod cotton occ leak fit relx infin devi well juic premium tast flavor time throat hit masarap sya u expect next transact u,2
purchas product good product consid sell price advertis advertis shope applic phone packag well made protect fragil content insid ship destin,2
good low price good item swak budget,2
good fast charg durabl good kid firm sturdi enough one camera okay lang recommend mahilig magtiktok magselfi got sim freebi,2
item receiv complet order well packag dent leak confirm avail item order ship next day,2
good maayo po dumat tama rin po order kuya nagdeliv,2
first time tri product great experi one flavor good deliv expect date,2
excel great silicon materi valu money worth super happi purchas arriv time,2
good none great good third time nang nakabili far pod e nagtag naman sakin pag gamit almost month cartridg,2
valu money excel excel maganda oki presyo kaso nagkamali size case puwed palitan nakakasad labg,2
fake item sold counterfeit iphon poor slow excit tri test purchas someth odd happen notic iphon camera seem fake immedi open check qualiti item wrong iphon sent actual fake camera qualiti poor system slow process insid outsid appear iphon fake,0
maganda valu money mura mukang matibay dadat buti nalang nag arriv maganda lobo lumipad langit pumutok pala sayang pera pambili baloon pagkain sana nabusog,2
love product arriv well deadlin beauti,2
work origin durabl long last sorri took long provid review feedback took week check item defect far good high recommend store type item purchas happi shop,2
qualiti great nice product overal worth price deliv fast much definit order,2
receiv w day control music long health app open background accur sleep hour step count pag nagstop magwalk saka sya total mani watch face pati boyfriend napa order much,2
shop trustworthi bought sever smartwatch alreadi legit dont hesit buy alway freebi great item,2
high afford juic brand tast def qualiti amaz item arriv time item great condit,2
strap ok price medyo matiga lang compar origin maganda yung case mahirap pindutin yung screen,2
valu money worth amount cheap qualiti maganda qualiti materi mukhang durabl magffaid cute design fit fit watch,2
far okay heartbeat bp nice nice nice,2
good qualiti valu money best buy cute color design love shop shop go need new set appl watch strap fast deliveri,2
valu money look durabl much star well pack damag item complet made hard plastic temper glass realli sure guess good enough protect watch,2
good excel use like product high qualiti materi afford price love color combin happi purchas good product high recommend,2
bulki yung case strap mayb yung pagka jelli strap nya malutong type,2
great afford phone great worth price excel qualiti item afford price well packag receiv item without damag advanc birthday gift uncl love recommend famili friend shope til next order,2
gannda strap parang origin bili deliveri earli date expect well recommend talaga,2
valu money afford nice good work swak swak grabi waka mgagamit watch tagal nagamit ksi gumagana ung charger nya buti lang gumana tong purchas,2
saya far good expect ganun effect anc sinc ear discomfort matag nasa tenga legit pag open lumaba agad yung galaxi wearabl gasga itong item unlik nakikita past review,2
good nice good uulitin order u nag deliv ingat po trabaho,2
good qualiti yung strap almost look like sya unlik orig itong strap medyo sya smooth ikabit ok nman sya yung case ok sya sakin maganda fit talaga sya pede maart hehe,2
adjust bracelet valu money good valu price good qualiti receiv item earlier declar eta alreadi tri band fit perfect next tri black one,2
nice good use yet kuya rider maganda qualiti masyadong matag dumat order bait kuya rider kudo kuya godbless,2
item correct complet maayo talaga pagkakapack seal devic say okay sya price tri flavor next time heheh,2
good buy sira packag arriv work naman kudo parin,2
excel qualiti item ship immedi accommod order well packag,2
camera batteri phone arriv good condit work well also got galaxi bud freebi discount voucher super sulit,2
color look good protector fit well valu money great valu money good qualiti nice item alreadi replac old bracelet instal protector look great far,2
legit yung product napabilib lang gale yong mabili napapakiusapan keep sayo god bless shop,2
standard qualiti excel look app reward watch child happi gift worth watch realli satisfi expect work realli well charg fast locat phone sport app bp heart rate weather etc nutshel son realli love think gon buy one soon,2
bili tama sbi ibang buyer kya bmili sknla kc nkita rate mggnda comment puro psitiv mgnda qualiti mura mbili cla ship item umord feb feb narcvd c item metro manila lng marerecommend mo c order,2
maganda po yung item bagay bagay watch po bother dun small dot okay lang cute sulit,2
legit fast deliveri well pack legit product recommend store buti nadeliv kagad order,2
star napakaganda po serbisyo nagsesend po pictur iship naman ship napakabili nilang shinip inabot nv tatlong araw item binili shop gumagana much,2
legit item,2
mabili ship sale complet order sobrang sulit sale sana mawala ung sale mahal pod,2
valu money serv purpos super love super luxuri datingan perfect starlight color nung bracelet case silver ok long protect watch scratch worri coz think soon magffad yung paint nya hope,2
item brand new excel condit second time purchas item base recent purchas still recommend item well,2
valu money maganda sya bibili ulit mejo matag lang dumat okay naman tnx,2
nice good first time omord shop nabigo legit yong phone nagustuhan anak ganda worth buy sayang pera okay naman cam nya,2
none valu money great pay get product deliv correct yes cheap qualiti okay bad price,2
excel qualiti accommod well packag item ship immedi order,2
color valu money afford good love color order afford complet order receiv well pack,2
nice aesthet work cute nya kasya small bag,2
receiv yesterday product good noth say green fine chose brown god bless,2
screen light qualiti authent never feel guilti purchas product shop know deserv work hard get buy definit order shop respons inquiri deserv star hard work team shop,2
safe rap nyo okay naman gamitin kaso naka adjust signal mahina yung kuha signal,2
smooth legit ganda phone fast deliveri,2
valu money right price fit appl watch,2
nd time order nice qualiti super love color aesthet definit worth buy,2
solid bos kudo masarap den juic paubo e susunod order uli sana maayo product uli maayo packag,2
receiv item good condit complet man lang nag msg si pala item refund naman yung dalawang item much shope,2
item correct ship quick tri check flavor good order,2
flavor great chillax yakult ice flavor fave like smok nord use tri jp blackcurr ice yet coolest look one buy much,2
order receiv bili lang dumat u safe naman dumat yung parcel kinakabahan bato sabon laman instead cellphon heheh,2
receiv day use almost week phone spec commend prob encount experienc kind glitch twice parang tv signal yung screen nya kala lalaba si sadako lol need restart fix sana maulit,2
tri newdesign valu money malapit ok star tama yung size parehong mm dumat mm yun red wine nakakasad,2
item receiv earlier expect love color look modern product also seem made good materi hope last long mich kudo,2
phone smooth camera shop high recommend definit buy oppo good job,2
fast transact even christma season,2
good good good oppo offici store receiv item complet damag legit shop origin oppo cellphon,2
binibigyan bituin gumagana maayo palagay presyo nito pagpipilian napapanood paboritong nobelang koreano ma malak screen habang nagtatrabaho bahay maayo naka pack kalak mabili n,2
good good good packag item good condit order complet correct respond st time buyer overal satisfi purchas gift mother,2
valu money worth describ rose gold strap eleg hope lock part last long manual adjust hard time figur overal great product,2
color valu money nice price averag strap long thin peopl like make work,2
natatri hope masarap yung juic good oorder ulit okay pagkag mabili ship okay oorder ulit ibang flavor mura nito kesa ibang store kudo kuya rider,2
watch nice bad price give watch gift well connect appl devic android phone hope last long parcel pack well damag come freebi strap shope,2
ship deliv time legit samsung phone second time order shop high qualiti best buy,2
super worth afford price smart watch afford appl watch okay itong smartwatch,2
good good good good naman sya leak lang okay lng least ma tipid sya compar bibili talaga relx pod definit buy,2
design valu money fair maganda north face alway heart pwede sya strap relo saya talaga sobra durabl naman tingnan,2
valu money good good maganda yung item kaso cover yung pinaka screen gilid lang yung meron got peso sulit plus free ship,2
ganda nung case realli like love glad bought shop love case deliv safe,2
valu money nice magnet complet item though took littl screen protector soft gel get screen protector glass silicon gel protector fit loo make watch look bigger strap though good nice exact pictur,2
ganda overal ok nman second order origin,2
ok valu money ok ok complet item get closer dream citi person loan loan much p flexibl payment term long year appli get approv fast hour c appli click citi person loan ad love section gcash app appli,2
valu money order receiv super nice item cheap price definit order kuya rider,2
good qualiti item safe well packag flavor good legit order soon,2
naresav po lang laman piro nagbayad po aq pano po makukuha un,2
got flash sale voucher coin discount automat updat english pair mifit app authent mi band charg full never take day includ sleep bathtim workout etc batteri still freebi,2
good good malasa good condit yung parcel leak pag date saken maganda pagkaka handl deliveri masarap yung juic malasang malasa,2
excel qualiti accommod well packag item ship immedi order updat,2
parcel secur pack arriv day place order still worth wait happi bought fit perfect mi band kudo power busi oh way screen protector sure includ anyway,2
everyth valu money worth purchas good qualiti recommend shop love qualiti product kinda loo okay pretti love color also nice worth purchas,2
well pack deliv immedi expect receiv exact th realli smooth transact encount issu,2
tama namn po yung dumat,2
legit nevok feelin occ coil item receiv week place order bad sinc cebu item luzon sure order,2
pooo astig syang legit clone issu wala leak tipid lang packag mabuti nalang nagka damag j super bili talaga servic sale shop,2
everyth good know connect phone wait almost week jshwhshididj ssjdjdjdjjdisjdisjsjsj qjjaisisjjsndjdndnnbdndndndjdjjdudidififiififjfgzhsjajakajjajssjwjeodoidrkridiidididkddkkdjdjehdbxhznsnsjshshsbsbsbsnsnjsududjsjaiak sus shs shsbshshsu shsusgwhqyu,2
price differ color valu money cheap hope last order mm check decid look box smart watch realiz order wrong size purpos chat said chang size origin order even though ship yet price parin naman ayun namali pag order size huhu order lang ulet size talaga smart watch see pag repli,2
realli protect valu money yes good receiv item good condit medyo matag dumat okay lang outsid philippin nang gale,2
valu money worth week dumat maganda lalo yung purpl worth,2
quit good look like origin textur bit differ though valu money good origin differ textur doabl quit nice also though shipment took bit longer expect got p great purchas alreadi order color krystal,2
qualiti legit pareh appear good legit bos pampalit sunog occ tri niyo par legit bibili susunod,2
valu money good price good nice cute chang strap anytim color order differ color soon recommend look like origin good qualiti product suit price keep good job,2
serv purpos valu money free great much free silicon wire wrap generos high recommend,2
easi chang band valu money good buy review dont lie materi origin happi bought check watch spare band use,2
good good good receiv order good satesfi costum shopp rider god bless,2
ok nman cia maganda,2
afford smart watch good qualiti star also shope deliveri rider,2
nice love design color white look eleg appl watch hope tri differ color love,2
valu money nice nice nice valu money item look durabl updat everi time follow order,2
great beginn friend awesom,2
great qualiti item ship immedi item receiv good condit much recommend shop order,2
doubt got super nice night mode pic video brighter clearer android phone use st pic use android phone nd pic super fast charg amaz liter video qualiti nice im g readi happi,2
excel excel fit well deliv time pack well love cheap price cheap qualiti tysm,2
good good good order arriv time packag isnt good see pictur product work fine though tast good buy someday,2
nice product took awhil deliv worth,2
kahapon inord knabukasan nandto bili thumb,2
clear valu money good plastic super ganda kaso classi tignan antag iship sinc oversea,2
everyth valu money excel qualiti good sure recommend other buy fast deliveri,2
nice valu money worth fit wrist arriv faster expect,2
item well pack secur receiv without damag tablet realli nice excel video sound qualiti well worth price origin case also nice easi instal remov sinc magnet high recommend product,2
strap awesom valu money get u pay nice high qualiti,2
good dumat screen protector,0
valu money afford excel swabe almost perfect sobrang ganda super legit look like origin bit hard lang touch side hard case important protect relo receiv earlier expect date tysm updat shope,2
correct color valu money good price good nmn kaso smwatch talaga prob screen nang cp prob kse nang order mm kasya nmn kso yung bottom nya iipit pati yung ikutan ipit ipit malaki lg talaga screen smwatch btw good qualiti totoong kasamang temper glass,2
wellmad valu money high qualiti order,2
warn product contain nicotin nicotin addict chemic name relx essenti model p la batteri capacio ren,2
excel fast charg reliabl mp microscop camera featur date oper system color o gb gb ram amaz yung microscop featur kitang kita yung fiber cloth,2
item arriv receiv good condit fast transact shopp rider nice item bought worth price,2
smooth long batteri day good qualiti pack okay deliv day consid came frm oversea look expens long batteri life big screen clear sound call easili connect phone bt fitcloud pro app problem far lot cheaper brand smartwatch hope last definit buy,2
excit naman sana item kaso po yung dumat wala yung strap sand pink mainland naman kind plea check order complet ship product good qualiti item complet order shop,2
super ok sure order purchac super okey smart bracelet function connect smart phone ive follow instruct im use sure order,2
camera dual video po free enco bud got sale peso voucher oppo shope sana magtag tong phone maganda sya lalo yung cam bili ideliv,2
ten measur heartbeat superb nmn mahirap iconnect phone im use rn pro dame featur hinahanap smartband bought earli bird promo voucher coin kasama pang freebi extra strap light blue,2
good nag leak good ok naman maganda narin egul purchas price nag leleak good qualiti recommend,2
excel excel valu money excel much item well pack excel condit qualiti sorri late review definit order recommend shop guy worth price wait,2
napakaganda item makapaniwala ganito mora qualiti talaga sya ginamit agad kilometro clear audio shope give star,2
built screen protector alreadi valu money good enough price fit galaxi watch well pink gold one silicon type plastic care put avoid scratch side watch transpar clear silicon,2
nice freebi lot worth price,2
mayb good gb memori look nice item smartphon oppo brand model look nice ok model gb memori model mah batteri capac although tri item yet hope purpos manufactur peopl republ china well item day,2
dumat order nakakabuwisit budol ata strap lang dumat wala yong relo mababalik paba yan,2
good legit high second time order shop nice legit store mentol flavor par gon buy,2
great product durabl like much fast deliveri go order hope spylat approv soon,2
excel qualiti reason price proper pack cone great freebi definit order,2
cute love design qualiti strap use occas also fashion yet classi look strap,2
work well gold finish good tri order sinc last relx broken alreadi turn legit hahaha love love u guy sent gold color u,2
freebi,2
great great great ok naman l r pareha gumagana medyo late lang sound nya game,2
legit legit request grant rosegold bh mejo matag lang charg kuya deliveri,2
good fresh red sweet menthol ice latt coffe great unfortun return due minor defect work fine love flavor yet know tatag flavor got earlier expect also,2
siguradong order ulit ganda sulit abot malinaw bose endors itong ganito produkto mapapa add cart talaga,2
fast ship pack ok item seal good promo discount shope sale far good work function proper,2
good almost new origin product almost new smooth realli small dent worri connect easi smooth,2
classi design valu money worth buy durabl order receiv right item damag high recommend shop u shope,2
watch case sparkl rhineston soo pretti,2
yet see valu money good appear upgrad band look good although panick first know adjust tini wrist experi screw driver trick packet extra tool indic instruct use sturdi tool poke like nail pusher screw driver hope tarnish say stainless steel yet find,2
great flavor best overal good qualiti masarap yung lasa fast deliveri hassl nakadam order maganda yung pag wrap item maayo yung packag sulit yung pag deliv mabili kausap yung shop,2
perfect rubber light valu money super duper love product afford yet qualiti perfect definit buy color,2
nd order po legit po shop custom napakad gamitin voic clear clear clear pati yung signal clear talaga frequenc maabot,2
valu money worthi nice anti slip readi take mobil experi next level level incred power flash g upgrad g devic miss exclus flash g data offer get gb flash g bonus data subscrib level pack flash g use g compat devic offer avail within ncr cebu citi mandau citi avail simpli open app click go buy manag promo page click tab stop receiv updat edit app notif set anytim,2
